<?xml version="1.0" encoding="UTF-8"?>
<GreensheetQuestions xmlns:xsi="http://www.w3.org/2001/XMLSchema-instance" xsi:noNamespaceSchemaLocation="..\schema\GsForm.xsd">
  <QuestionDef id="DMNCQ_110">
    <GrantTypeMechs>
      <TypeMech type="5" mech="C06"/>
      <TypeMech type="8" mech="C06"/>
      <TypeMech type="5" mech="F30"/>
      <TypeMech type="8" mech="F30"/>
      <TypeMech type="5" mech="F31"/>
      <TypeMech type="8" mech="F31"/>
      <TypeMech type="5" mech="F32"/>
      <TypeMech type="8" mech="F32"/>
      <TypeMech type="5" mech="F33"/>
      <TypeMech type="8" mech="F33"/>
      <TypeMech type="5" mech="K01"/>
      <TypeMech type="8" mech="K01"/>
      <TypeMech type="5" mech="K04"/>
      <TypeMech type="8" mech="K04"/>
      <TypeMech type="5" mech="K05"/>
      <TypeMech type="8" mech="K05"/>
      <TypeMech type="5" mech="K07"/>
      <TypeMech type="8" mech="K07"/>
      <TypeMech type="5" mech="K08"/>
      <TypeMech type="8" mech="K08"/>
      <TypeMech type="5" mech="K11"/>
      <TypeMech type="8" mech="K11"/>
      <TypeMech type="5" mech="K12"/>
      <TypeMech type="8" mech="K12"/>
      <TypeMech type="5" mech="K14"/>
      <TypeMech type="8" mech="K14"/>
      <TypeMech type="5" mech="K22"/>
      <TypeMech type="8" mech="K22"/>
      <TypeMech type="5" mech="K23"/>
      <TypeMech type="8" mech="K23"/>
      <TypeMech type="5" mech="K24"/>
      <TypeMech type="8" mech="K24"/>
      <TypeMech type="5" mech="K25"/>
      <TypeMech type="8" mech="K25"/>
      <TypeMech type="5" mech="K99"/>
      <TypeMech type="8" mech="K99"/>
      <TypeMech type="5" mech="KL1"/>
      <TypeMech type="8" mech="KL1"/>
      <TypeMech type="5" mech="KL2"/>
      <TypeMech type="8" mech="KL2"/>
      <TypeMech type="5" mech="P01"/>
      <TypeMech type="8" mech="P01"/>
      <TypeMech type="5" mech="P20"/>
      <TypeMech type="8" mech="P20"/>
      <TypeMech type="5" mech="P30"/>
      <TypeMech type="8" mech="P30"/>
      <TypeMech type="5" mech="P50"/>
      <TypeMech type="8" mech="P50"/>
      <TypeMech type="5" mech="PL1"/>
      <TypeMech type="8" mech="PL1"/>
      <TypeMech type="5" mech="R00"/>
      <TypeMech type="8" mech="R00"/>
      <TypeMech type="5" mech="R01"/>
      <TypeMech type="8" mech="R01"/>
      <TypeMech type="5" mech="R03"/>
      <TypeMech type="8" mech="R03"/>
      <TypeMech type="5" mech="R13"/>
      <TypeMech type="8" mech="R13"/>
      <TypeMech type="5" mech="R15"/>
      <TypeMech type="8" mech="R15"/>
      <TypeMech type="5" mech="R18"/>
      <TypeMech type="8" mech="R18"/>
      <TypeMech type="5" mech="R21"/>
      <TypeMech type="8" mech="R21"/>
      <TypeMech type="5" mech="R24"/>
      <TypeMech type="8" mech="R24"/>
      <TypeMech type="5" mech="R25"/>
      <TypeMech type="8" mech="R25"/>
      <TypeMech type="5" mech="R29"/>
      <TypeMech type="8" mech="R29"/>
      <TypeMech type="5" mech="R33"/>
      <TypeMech type="8" mech="R33"/>
      <TypeMech type="5" mech="R35"/>
      <TypeMech type="8" mech="R35"/>
      <TypeMech type="5" mech="R37"/>
      <TypeMech type="8" mech="R37"/>
      <TypeMech type="5" mech="R41"/>
      <TypeMech type="8" mech="R41"/>
      <TypeMech type="5" mech="R42"/>
      <TypeMech type="8" mech="R42"/>
      <TypeMech type="5" mech="R43"/>
      <TypeMech type="8" mech="R43"/>
      <TypeMech type="5" mech="R44"/>
      <TypeMech type="8" mech="R44"/>
      <TypeMech type="5" mech="R55"/>
      <TypeMech type="8" mech="R55"/>
      <TypeMech type="5" mech="R56"/>
      <TypeMech type="8" mech="R56"/>
      <TypeMech type="5" mech="RL1"/>
      <TypeMech type="8" mech="RL1"/>
      <TypeMech type="5" mech="RL2"/>
      <TypeMech type="8" mech="RL2"/>
      <TypeMech type="5" mech="RL5"/>
      <TypeMech type="8" mech="RL5"/>
      <TypeMech type="5" mech="RL9"/>
      <TypeMech type="8" mech="RL9"/>
      <TypeMech type="5" mech="S15"/>
      <TypeMech type="8" mech="S15"/>
      <TypeMech type="5" mech="SC1"/>
      <TypeMech type="8" mech="SC1"/>
      <TypeMech type="5" mech="SC2"/>
      <TypeMech type="8" mech="SC2"/>
      <TypeMech type="5" mech="T15"/>
      <TypeMech type="8" mech="T15"/>
      <TypeMech type="5" mech="T32"/>
      <TypeMech type="8" mech="T32"/>
      <TypeMech type="5" mech="TL1"/>
      <TypeMech type="8" mech="TL1"/>
      <TypeMech type="5" mech="TU2"/>
      <TypeMech type="8" mech="TU2"/>
      <TypeMech type="5" mech="U01"/>
      <TypeMech type="8" mech="U01"/>
      <TypeMech type="5" mech="U09"/>
      <TypeMech type="8" mech="U09"/>
      <TypeMech type="5" mech="U10"/>
      <TypeMech type="8" mech="U10"/>
      <TypeMech type="5" mech="U13"/>
      <TypeMech type="8" mech="U13"/>
      <TypeMech type="5" mech="U19"/>
      <TypeMech type="8" mech="U19"/>
      <TypeMech type="5" mech="U24"/>
      <TypeMech type="8" mech="U24"/>
      <TypeMech type="5" mech="U43"/>
      <TypeMech type="8" mech="U43"/>
      <TypeMech type="5" mech="U44"/>
      <TypeMech type="8" mech="U44"/>
      <TypeMech type="5" mech="U54"/>
      <TypeMech type="8" mech="U54"/>
      <TypeMech type="5" mech="U56"/>
      <TypeMech type="8" mech="U56"/>
      <TypeMech type="5" mech="UL1"/>
      <TypeMech type="8" mech="UL1"/>
    </GrantTypeMechs>
    <QText>Was this application received electronically?</QText>
    <QInstructions/>
    <ResponseDefsList>
      <ResponseDef id="DMNCQ_110_RD_CM_1" type="COMMENT"/>
      <ResponseDef id="DMNCQ_110_RD_FL_1" type="FILE"/>
      <ResponseDef id="DMNCQ_110_RD_RB_1" type="RADIO">
        <SelectionDef id="SEL_8001">
          <Value>Yes</Value>
        </SelectionDef>
        <SelectionDef id="SEL_8002">
          <Value>No</Value>
        </SelectionDef>
      </ResponseDef>
    </ResponseDefsList>
  </QuestionDef>
  <QuestionDef id="DMNCQ_120">
    <GrantTypeMechs>
      <TypeMech type="5" mech="C06"/>
      <TypeMech type="8" mech="C06"/>
      <TypeMech type="5" mech="F30"/>
      <TypeMech type="8" mech="F30"/>
      <TypeMech type="5" mech="F31"/>
      <TypeMech type="8" mech="F31"/>
      <TypeMech type="5" mech="F32"/>
      <TypeMech type="8" mech="F32"/>
      <TypeMech type="5" mech="F33"/>
      <TypeMech type="8" mech="F33"/>
      <TypeMech type="5" mech="K01"/>
      <TypeMech type="8" mech="K01"/>
      <TypeMech type="5" mech="K04"/>
      <TypeMech type="8" mech="K04"/>
      <TypeMech type="5" mech="K05"/>
      <TypeMech type="8" mech="K05"/>
      <TypeMech type="5" mech="K07"/>
      <TypeMech type="8" mech="K07"/>
      <TypeMech type="5" mech="K08"/>
      <TypeMech type="8" mech="K08"/>
      <TypeMech type="5" mech="K11"/>
      <TypeMech type="8" mech="K11"/>
      <TypeMech type="5" mech="K12"/>
      <TypeMech type="8" mech="K12"/>
      <TypeMech type="5" mech="K14"/>
      <TypeMech type="8" mech="K14"/>
      <TypeMech type="5" mech="K22"/>
      <TypeMech type="8" mech="K22"/>
      <TypeMech type="5" mech="K23"/>
      <TypeMech type="8" mech="K23"/>
      <TypeMech type="5" mech="K24"/>
      <TypeMech type="8" mech="K24"/>
      <TypeMech type="5" mech="K25"/>
      <TypeMech type="8" mech="K25"/>
      <TypeMech type="5" mech="K99"/>
      <TypeMech type="8" mech="K99"/>
      <TypeMech type="5" mech="KL1"/>
      <TypeMech type="8" mech="KL1"/>
      <TypeMech type="5" mech="KL2"/>
      <TypeMech type="8" mech="KL2"/>
      <TypeMech type="5" mech="P01"/>
      <TypeMech type="8" mech="P01"/>
      <TypeMech type="5" mech="P20"/>
      <TypeMech type="8" mech="P20"/>
      <TypeMech type="5" mech="P30"/>
      <TypeMech type="8" mech="P30"/>
      <TypeMech type="5" mech="P50"/>
      <TypeMech type="8" mech="P50"/>
      <TypeMech type="5" mech="PL1"/>
      <TypeMech type="8" mech="PL1"/>
      <TypeMech type="5" mech="R00"/>
      <TypeMech type="8" mech="R00"/>
      <TypeMech type="5" mech="R01"/>
      <TypeMech type="8" mech="R01"/>
      <TypeMech type="5" mech="R03"/>
      <TypeMech type="8" mech="R03"/>
      <TypeMech type="5" mech="R13"/>
      <TypeMech type="8" mech="R13"/>
      <TypeMech type="5" mech="R15"/>
      <TypeMech type="8" mech="R15"/>
      <TypeMech type="5" mech="R18"/>
      <TypeMech type="8" mech="R18"/>
      <TypeMech type="5" mech="R21"/>
      <TypeMech type="8" mech="R21"/>
      <TypeMech type="5" mech="R24"/>
      <TypeMech type="8" mech="R24"/>
      <TypeMech type="5" mech="R25"/>
      <TypeMech type="8" mech="R25"/>
      <TypeMech type="5" mech="R29"/>
      <TypeMech type="8" mech="R29"/>
      <TypeMech type="5" mech="R33"/>
      <TypeMech type="8" mech="R33"/>
      <TypeMech type="5" mech="R35"/>
      <TypeMech type="8" mech="R35"/>
      <TypeMech type="5" mech="R37"/>
      <TypeMech type="8" mech="R37"/>
      <TypeMech type="5" mech="R41"/>
      <TypeMech type="8" mech="R41"/>
      <TypeMech type="5" mech="R42"/>
      <TypeMech type="8" mech="R42"/>
      <TypeMech type="5" mech="R43"/>
      <TypeMech type="8" mech="R43"/>
      <TypeMech type="5" mech="R44"/>
      <TypeMech type="8" mech="R44"/>
      <TypeMech type="5" mech="R55"/>
      <TypeMech type="8" mech="R55"/>
      <TypeMech type="5" mech="R56"/>
      <TypeMech type="8" mech="R56"/>
      <TypeMech type="5" mech="RL1"/>
      <TypeMech type="8" mech="RL1"/>
      <TypeMech type="5" mech="RL2"/>
      <TypeMech type="8" mech="RL2"/>
      <TypeMech type="5" mech="RL5"/>
      <TypeMech type="8" mech="RL5"/>
      <TypeMech type="5" mech="RL9"/>
      <TypeMech type="8" mech="RL9"/>
      <TypeMech type="5" mech="S15"/>
      <TypeMech type="8" mech="S15"/>
      <TypeMech type="5" mech="SC1"/>
      <TypeMech type="8" mech="SC1"/>
      <TypeMech type="5" mech="SC2"/>
      <TypeMech type="8" mech="SC2"/>